/home/xuxuezhou/miniconda3/envs/RoboTwin/lib/python3.10/site-packages/ultralytics/nn/tasks.py:775: FutureWarning: You are using `torch.load` with `weights_only=False` (the current default value), which uses the default pickle module implicitly. It is possible to construct malicious pickle data which will execute arbitrary code during unpickling (See https://github.com/pytorch/pytorch/blob/main/SECURITY.md#untrusted-models for more details). In a future release, the default value for `weights_only` will be flipped to `True`. This limits the functions that could be executed during unpickling. Arbitrary objects will no longer be allowed to be loaded via this mode unless they are explicitly allowlisted by the user via `torch.serialization.add_safe_globals`. We recommend you start setting `weights_only=True` for any use case where you don't have full control of the loaded file. Please open an issue on GitHub for any issues related to this experimental feature.
  ckpt = torch.load(file, map_location="cpu")
/home/xuxuezhou/code/RoboTwin/policy/ManiBox/manibox/ManiBox/dataloader/data_load.py:21: FutureWarning: You are using `torch.load` with `weights_only=False` (the current default value), which uses the default pickle module implicitly. It is possible to construct malicious pickle data which will execute arbitrary code during unpickling (See https://github.com/pytorch/pytorch/blob/main/SECURITY.md#untrusted-models for more details). In a future release, the default value for `weights_only` will be flipped to `True`. This limits the functions that could be executed during unpickling. Arbitrary objects will no longer be allowed to be loaded via this mode unless they are explicitly allowlisted by the user via `torch.serialization.add_safe_globals`. We recommend you start setting `weights_only=True` for any use case where you don't have full control of the loaded file. Please open an issue on GitHub for any issues related to this experimental feature.
  data = torch.load(os.path.join(dataset_dir, "integration.pkl"), map_location='cpu')
/home/xuxuezhou/code/RoboTwin/policy/ManiBox/manibox/ManiBox/dataloader/BBoxHistoryEpisodicDataset.py:52: FutureWarning: You are using `torch.load` with `weights_only=False` (the current default value), which uses the default pickle module implicitly. It is possible to construct malicious pickle data which will execute arbitrary code during unpickling (See https://github.com/pytorch/pytorch/blob/main/SECURITY.md#untrusted-models for more details). In a future release, the default value for `weights_only` will be flipped to `True`. This limits the functions that could be executed during unpickling. Arbitrary objects will no longer be allowed to be loaded via this mode unless they are explicitly allowlisted by the user via `torch.serialization.add_safe_globals`. We recommend you start setting `weights_only=True` for any use case where you don't have full control of the loaded file. Please open an issue on GitHub for any issues related to this experimental feature.
  self.data = torch.load(os.path.join(self.dataset_dir, "integration.pkl"), map_location='cpu')
/home/xuxuezhou/miniconda3/envs/RoboTwin/lib/python3.10/site-packages/torchvision/models/_utils.py:208: UserWarning: The parameter 'pretrained' is deprecated since 0.13 and may be removed in the future, please use 'weights' instead.
  warnings.warn(
/home/xuxuezhou/miniconda3/envs/RoboTwin/lib/python3.10/site-packages/torchvision/models/_utils.py:223: UserWarning: Arguments other than a weight enum or `None` for 'weights' are deprecated since 0.13 and may be removed in the future. The current behavior is equivalent to passing `weights=None`.
  warnings.warn(msg)
Timestamp: 2025-07-29_20-15-33
scheduler: cos args.gradient_accumulation_steps 2
whether use acclerator: False
cur_path /home/xuxuezhou/code/RoboTwin/policy/ManiBox/manibox/ManiBox
num episodes 500
🎯 Using custom objects: ['bottle', 'bottle']
📊 Expected bbox dimension: 24

Data from: policy/ManiBox/processed_data/manibox-pick-diverse-bottles

Load data from policy/ManiBox/processed_data/manibox-pick-diverse-bottles/integration.pkl Shape:  torch.Size([500, 158, 1, 24])
image_data.shape, qpos_data.shape, action_data.shape:  torch.Size([90, 12]) torch.Size([90, 14]) torch.Size([90, 14])
Load data from policy/ManiBox/processed_data/manibox-pick-diverse-bottles/integration.pkl Shape:  torch.Size([500, 158, 1, 24])
image_data.shape, qpos_data.shape, action_data.shape:  torch.Size([90, 12]) torch.Size([90, 14]) torch.Size([90, 14])
length of train dataloader 8
You are using DiffusionPolicy.
policy_config {'lr': 0.0001, 'lr_backbone': 7e-05, 'epochs': 200, 'train_loader_len': 8, 'warmup_ratio': 0.1, 'use_scheduler': 'cos', 'backbone': 'resnet18', 'masks': False, 'weight_decay': 0.0001, 'dilation': False, 'position_embedding': 'sine', 'loss_function': 'mse', 'chunk_size': 1, 'camera_names': ['cam_high', 'cam_left_wrist', 'cam_right_wrist'], 'num_next_action': 0, 'use_depth_image': False, 'use_robot_base': False, 'hidden_dim': 512, 'device': 'cuda:0', 'state_dim': 14, 'action_dim': 14, 'observation_horizon': 1, 'action_horizon': 4, 'num_inference_timesteps': 50, 'ema_power': 0.75, 'alpha': 3.0, 'max_time_steps': 1000, 'time_embed_dim': 128, 'context_len': 90, 'num_samples_per_traj': 10, 'policy_class': 'Diffusion', 'gradient_accumulation_steps': 2}
backbone visual encoder. number of parameters: 33.50M
diffusion model. number of parameters: 0.78M
  0%|          | 0/200 [00:00<?, ?it/s]
0it [00:00, ?it/s][A
                  [A
Epoch 0, lr: 1e-05
Train loss: 3.95875
loss: 3.959 
Saved plots to ./ckpt/2025-07-29_20-15-33Diffusion
  0%|          | 1/200 [00:01<04:04,  1.23s/it]Best ckpt saved, val loss 4.163599 @ epoch0
Val loss:   4.16360.   Best val loss: 4.16360 at epoch 0
loss: 4.164 

Epoch 1, lr: 2e-05
Train loss: 4.00738
loss: 4.007 
Saved plots to ./ckpt/2025-07-29_20-15-33Diffusion
  1%|          | 2/200 [00:02<03:35,  1.09s/it]Best ckpt saved, val loss 3.924074 @ epoch1
Val loss:   3.92407.   Best val loss: 3.92407 at epoch 1
loss: 3.924 

Epoch 2, lr: 3e-05
Train loss: 3.91396
loss: 3.914 
Saved plots to ./ckpt/2025-07-29_20-15-33Diffusion
  2%|▁         | 3/200 [00:02<02:52,  1.15it/s]Val loss:   3.92663.   Best val loss: 3.92407 at epoch 1
loss: 3.927 

Epoch 3, lr: 4e-05
Train loss: 3.92330
loss: 3.923 
Saved plots to ./ckpt/2025-07-29_20-15-33Diffusion
  2%|▁         | 4/200 [00:03<03:07,  1.04it/s]Best ckpt saved, val loss 3.800365 @ epoch3
Val loss:   3.80036.   Best val loss: 3.80036 at epoch 3
loss: 3.800 

Epoch 4, lr: 5e-05
Train loss: 3.99550
loss: 3.995 
Saved plots to ./ckpt/2025-07-29_20-15-33Diffusion
  2%|▎         | 5/200 [00:04<03:10,  1.02it/s]Best ckpt saved, val loss 3.682966 @ epoch4
Val loss:   3.68297.   Best val loss: 3.68297 at epoch 4
loss: 3.683 

Epoch 5, lr: 6e-05
Train loss: 4.09213
loss: 4.092 
Saved plots to ./ckpt/2025-07-29_20-15-33Diffusion
  3%|▎         | 6/200 [00:05<02:47,  1.16it/s]Val loss:   3.89203.   Best val loss: 3.68297 at epoch 4
loss: 3.892 

Epoch 6, lr: 7e-05
Train loss: 3.98361
loss: 3.984 
Saved plots to ./ckpt/2025-07-29_20-15-33Diffusion
  4%|▎         | 7/200 [00:06<02:31,  1.27it/s]Val loss:   3.97199.   Best val loss: 3.68297 at epoch 4
loss: 3.972 

Epoch 7, lr: 8e-05
Train loss: 4.07173
loss: 4.072 
Saved plots to ./ckpt/2025-07-29_20-15-33Diffusion
  4%|▁         | 8/200 [00:06<02:22,  1.35it/s]Val loss:   4.18026.   Best val loss: 3.68297 at epoch 4
loss: 4.180 

Epoch 8, lr: 9e-05
Train loss: 3.92890
loss: 3.929 
Saved plots to ./ckpt/2025-07-29_20-15-33Diffusion
  4%|▁         | 9/200 [00:07<02:15,  1.41it/s]Val loss:   3.93954.   Best val loss: 3.68297 at epoch 4
loss: 3.940 

Epoch 9, lr: 0.0001
Train loss: 3.95937
loss: 3.959 
Saved plots to ./ckpt/2025-07-29_20-15-33Diffusion
  5%|▌         | 10/200 [00:08<02:13,  1.43it/s]Val loss:   3.87401.   Best val loss: 3.68297 at epoch 4
loss: 3.874 

Epoch 10, lr: 9.99695413509548e-05
Train loss: 4.05444
loss: 4.054 
Saved plots to ./ckpt/2025-07-29_20-15-33Diffusion
  6%|▌         | 11/200 [00:08<02:10,  1.45it/s]Val loss:   3.98993.   Best val loss: 3.68297 at epoch 4
loss: 3.990 

Epoch 11, lr: 9.987820251299122e-05
Train loss: 3.92218
loss: 3.922 
Saved plots to ./ckpt/2025-07-29_20-15-33Diffusion
  6%|▌         | 12/200 [00:09<02:08,  1.47it/s]Val loss:   3.94675.   Best val loss: 3.68297 at epoch 4
loss: 3.947 

Epoch 12, lr: 9.972609476841367e-05
Train loss: 4.02754
loss: 4.028 
Saved plots to ./ckpt/2025-07-29_20-15-33Diffusion
  6%|▋         | 13/200 [00:10<02:07,  1.46it/s]Val loss:   3.94510.   Best val loss: 3.68297 at epoch 4
loss: 3.945 

Epoch 13, lr: 9.951340343707852e-05
Train loss: 4.04375
loss: 4.044 
Saved plots to ./ckpt/2025-07-29_20-15-33Diffusion
  7%|▋         | 14/200 [00:10<02:06,  1.47it/s]Val loss:   4.22224.   Best val loss: 3.68297 at epoch 4
loss: 4.222 

Epoch 14, lr: 9.924038765061042e-05
Train loss: 3.92698
loss: 3.927 
Saved plots to ./ckpt/2025-07-29_20-15-33Diffusion
  8%|▊         | 15/200 [00:11<02:05,  1.48it/s]Val loss:   3.96719.   Best val loss: 3.68297 at epoch 4
loss: 3.967 

Epoch 15, lr: 9.890738003669029e-05
Train loss: 3.93417
loss: 3.934 
Saved plots to ./ckpt/2025-07-29_20-15-33Diffusion
  8%|▊         | 16/200 [00:12<02:06,  1.45it/s]Val loss:   4.00313.   Best val loss: 3.68297 at epoch 4
loss: 4.003 

Epoch 16, lr: 9.851478631379982e-05
Train loss: 4.11279
loss: 4.113 
Saved plots to ./ckpt/2025-07-29_20-15-33Diffusion
  8%|▊         | 17/200 [00:12<02:05,  1.45it/s]Val loss:   3.97445.   Best val loss: 3.68297 at epoch 4
loss: 3.974 

Epoch 17, lr: 9.806308479691595e-05
Train loss: 4.06906
loss: 4.069 
Saved plots to ./ckpt/2025-07-29_20-15-33Diffusion
  9%|▉         | 18/200 [00:13<02:05,  1.45it/s]Val loss:   3.91522.   Best val loss: 3.68297 at epoch 4
loss: 3.915 

Epoch 18, lr: 9.755282581475769e-05
Train loss: 4.01400
loss: 4.014 
Saved plots to ./ckpt/2025-07-29_20-15-33Diffusion
 10%|▉         | 19/200 [00:14<02:03,  1.46it/s]Val loss:   4.05528.   Best val loss: 3.68297 at epoch 4
loss: 4.055 

Epoch 19, lr: 9.698463103929542e-05
Train loss: 4.02129
loss: 4.021 
Saved plots to ./ckpt/2025-07-29_20-15-33Diffusion
 10%|█         | 20/200 [00:14<02:02,  1.46it/s]Val loss:   4.11204.   Best val loss: 3.68297 at epoch 4
loss: 4.112 
/home/xuxuezhou/code/RoboTwin/policy/ManiBox/manibox/ManiBox/train.py:147: RuntimeWarning: More than 20 figures have been opened. Figures created through the pyplot interface (`matplotlib.pyplot.figure`) are retained until explicitly closed and may consume too much memory. (To control this warning, see the rcParam `figure.max_open_warning`). Consider using `matplotlib.pyplot.close()`.
  plt.figure()

Epoch 20, lr: 9.635919272833938e-05
Train loss: 4.28767
loss: 4.288 
Saved plots to ./ckpt/2025-07-29_20-15-33Diffusion
 10%|█         | 21/200 [00:15<02:10,  1.37it/s]Val loss:   4.17141.   Best val loss: 3.68297 at epoch 4
loss: 4.171 

Epoch 21, lr: 9.567727288213005e-05
Train loss: 4.01282
loss: 4.013 
Saved plots to ./ckpt/2025-07-29_20-15-33Diffusion
 11%|█         | 22/200 [00:16<02:08,  1.38it/s]Val loss:   4.21993.   Best val loss: 3.68297 at epoch 4
loss: 4.220 

Epoch 22, lr: 9.493970231495835e-05
Train loss: 3.97272
loss: 3.973 
Saved plots to ./ckpt/2025-07-29_20-15-33Diffusion
 12%|█▁        | 23/200 [00:17<02:07,  1.39it/s]Val loss:   3.85959.   Best val loss: 3.68297 at epoch 4
loss: 3.860 

Epoch 23, lr: 9.414737964294636e-05
Train loss: 3.98869
loss: 3.989 
Saved plots to ./ckpt/2025-07-29_20-15-33Diffusion
 12%|█▁        | 24/200 [00:17<02:04,  1.42it/s]Val loss:   4.09404.   Best val loss: 3.68297 at epoch 4
loss: 4.094 

Epoch 24, lr: 9.330127018922194e-05
Train loss: 3.98858
loss: 3.989 
Saved plots to ./ckpt/2025-07-29_20-15-33Diffusion
 12%|█▎        | 25/200 [00:18<02:03,  1.41it/s]Val loss:   3.93512.   Best val loss: 3.68297 at epoch 4
loss: 3.935 

Epoch 25, lr: 9.24024048078213e-05
Train loss: 3.93490
loss: 3.935 
Saved plots to ./ckpt/2025-07-29_20-15-33Diffusion
 13%|█▎        | 26/200 [00:19<02:02,  1.42it/s]Val loss:   4.13782.   Best val loss: 3.68297 at epoch 4
loss: 4.138 

Epoch 26, lr: 9.145187862775209e-05
Train loss: 3.90894
loss: 3.909 
Saved plots to ./ckpt/2025-07-29_20-15-33Diffusion
 14%|█▎        | 27/200 [00:20<02:02,  1.41it/s]Val loss:   4.06149.   Best val loss: 3.68297 at epoch 4
loss: 4.061 

Epoch 27, lr: 9.045084971874738e-05
Train loss: 4.02470
loss: 4.025 
Saved plots to ./ckpt/2025-07-29_20-15-33Diffusion
 14%|█▁        | 28/200 [00:20<02:00,  1.42it/s]Val loss:   3.89497.   Best val loss: 3.68297 at epoch 4
loss: 3.895 

Epoch 28, lr: 8.940053768033609e-05
Train loss: 4.08923
loss: 4.089 
Saved plots to ./ckpt/2025-07-29_20-15-33Diffusion
 14%|█▁        | 29/200 [00:21<02:02,  1.39it/s]Val loss:   3.92356.   Best val loss: 3.68297 at epoch 4
loss: 3.924 

Epoch 29, lr: 8.83022221559489e-05
Train loss: 4.00298
loss: 4.003 
Saved plots to ./ckpt/2025-07-29_20-15-33Diffusion
 15%|█▌        | 30/200 [00:22<02:03,  1.38it/s]Val loss:   4.09576.   Best val loss: 3.68297 at epoch 4
loss: 4.096 

Epoch 30, lr: 8.715724127386972e-05
Train loss: 3.94289
loss: 3.943 
Saved plots to ./ckpt/2025-07-29_20-15-33Diffusion
 16%|█▌        | 31/200 [00:22<02:00,  1.40it/s]Val loss:   4.15978.   Best val loss: 3.68297 at epoch 4
loss: 4.160 

Epoch 31, lr: 8.596699001693255e-05
Train loss: 4.00333
loss: 4.003 
Saved plots to ./ckpt/2025-07-29_20-15-33Diffusion
 16%|█▌        | 32/200 [00:23<02:01,  1.38it/s]Val loss:   4.12769.   Best val loss: 3.68297 at epoch 4
loss: 4.128 

Epoch 32, lr: 8.473291852294987e-05
Train loss: 4.06031
loss: 4.060 
Saved plots to ./ckpt/2025-07-29_20-15-33Diffusion
 16%|█▋        | 33/200 [00:24<02:01,  1.38it/s]Val loss:   3.94686.   Best val loss: 3.68297 at epoch 4
loss: 3.947 

Epoch 33, lr: 8.345653031794292e-05
Train loss: 3.97922
loss: 3.979 
Saved plots to ./ckpt/2025-07-29_20-15-33Diffusion
 17%|█▋        | 34/200 [00:25<02:00,  1.38it/s]Val loss:   4.18342.   Best val loss: 3.68297 at epoch 4
loss: 4.183 

Epoch 34, lr: 8.213938048432697e-05
Train loss: 3.94991
loss: 3.950 
Saved plots to ./ckpt/2025-07-29_20-15-33Diffusion
 18%|█▊        | 35/200 [00:25<02:01,  1.36it/s]Val loss:   3.97483.   Best val loss: 3.68297 at epoch 4
loss: 3.975 

Epoch 35, lr: 8.07830737662829e-05
Train loss: 3.89354
loss: 3.894 
Saved plots to ./ckpt/2025-07-29_20-15-33Diffusion
 18%|█▊        | 36/200 [00:26<02:00,  1.36it/s]Val loss:   3.95411.   Best val loss: 3.68297 at epoch 4
loss: 3.954 

Epoch 36, lr: 7.938926261462366e-05
Train loss: 4.01202
loss: 4.012 
Saved plots to ./ckpt/2025-07-29_20-15-33Diffusion
 18%|█▊        | 37/200 [00:27<02:00,  1.35it/s]Val loss:   3.97101.   Best val loss: 3.68297 at epoch 4
loss: 3.971 

Epoch 37, lr: 7.795964517353735e-05
Train loss: 4.05596
loss: 4.056 
Saved plots to ./ckpt/2025-07-29_20-15-33Diffusion
 19%|█▉        | 38/200 [00:28<01:58,  1.36it/s]Val loss:   3.99890.   Best val loss: 3.68297 at epoch 4
loss: 3.999 

Epoch 38, lr: 7.649596321166024e-05
Train loss: 4.00947
loss: 4.009 
Saved plots to ./ckpt/2025-07-29_20-15-33Diffusion
 20%|█▉        | 39/200 [00:28<01:58,  1.36it/s]Val loss:   3.86672.   Best val loss: 3.68297 at epoch 4
loss: 3.867 

Epoch 39, lr: 7.500000000000001e-05
Train loss: 4.03676
loss: 4.037 
Saved plots to ./ckpt/2025-07-29_20-15-33Diffusion
 20%|██        | 40/200 [00:29<02:00,  1.32it/s]Val loss:   3.99264.   Best val loss: 3.68297 at epoch 4
loss: 3.993 

Epoch 40, lr: 7.347357813929454e-05
Train loss: 4.01643
loss: 4.016 
Saved plots to ./ckpt/2025-07-29_20-15-33Diffusion
 20%|██        | 41/200 [00:30<02:00,  1.32it/s]Val loss:   4.05170.   Best val loss: 3.68297 at epoch 4
loss: 4.052 

Epoch 41, lr: 7.191855733945387e-05
Train loss: 3.92080
loss: 3.921 
Saved plots to ./ckpt/2025-07-29_20-15-33Diffusion
 21%|██        | 42/200 [00:31<02:01,  1.31it/s]Val loss:   4.24569.   Best val loss: 3.68297 at epoch 4
loss: 4.246 

Epoch 42, lr: 7.033683215379002e-05
Train loss: 4.04134
loss: 4.041 
Saved plots to ./ckpt/2025-07-29_20-15-33Diffusion
 22%|██▁       | 43/200 [00:31<02:00,  1.30it/s]Val loss:   3.84529.   Best val loss: 3.68297 at epoch 4
loss: 3.845 

Epoch 43, lr: 6.873032967079561e-05
Train loss: 4.18469
loss: 4.185 
Saved plots to ./ckpt/2025-07-29_20-15-33Diffusion
 22%|██▁       | 44/200 [00:32<01:59,  1.31it/s]Val loss:   3.96232.   Best val loss: 3.68297 at epoch 4
loss: 3.962 

Epoch 44, lr: 6.710100716628344e-05
Train loss: 3.98298
loss: 3.983 
Saved plots to ./ckpt/2025-07-29_20-15-33Diffusion
 22%|██▎       | 45/200 [00:33<02:04,  1.24it/s]Val loss:   3.89216.   Best val loss: 3.68297 at epoch 4
loss: 3.892 

Epoch 45, lr: 6.545084971874738e-05
Train loss: 4.05184
loss: 4.052 
Saved plots to ./ckpt/2025-07-29_20-15-33Diffusion
 23%|██▎       | 46/200 [00:34<02:03,  1.24it/s]Val loss:   3.91971.   Best val loss: 3.68297 at epoch 4
loss: 3.920 

Epoch 46, lr: 6.378186779084995e-05
Train loss: 3.99649
loss: 3.996 
Saved plots to ./ckpt/2025-07-29_20-15-33Diffusion
 24%|██▎       | 47/200 [00:35<02:00,  1.27it/s]Val loss:   4.03694.   Best val loss: 3.68297 at epoch 4
loss: 4.037 

Epoch 47, lr: 6.209609477998338e-05
Train loss: 4.03594
loss: 4.036 
Saved plots to ./ckpt/2025-07-29_20-15-33Diffusion
 24%|██▁       | 48/200 [00:35<01:57,  1.29it/s]Val loss:   3.96653.   Best val loss: 3.68297 at epoch 4
loss: 3.967 

Epoch 48, lr: 6.0395584540887963e-05
Train loss: 4.04038
loss: 4.040 
Saved plots to ./ckpt/2025-07-29_20-15-33Diffusion
 24%|██▁       | 49/200 [00:36<01:56,  1.30it/s]Val loss:   4.10113.   Best val loss: 3.68297 at epoch 4
loss: 4.101 

Epoch 49, lr: 5.868240888334653e-05
Train loss: 4.08938
loss: 4.089 
Saved plots to ./ckpt/2025-07-29_20-15-33Diffusion
 25%|██▌       | 50/200 [00:37<01:56,  1.29it/s]Val loss:   4.01590.   Best val loss: 3.68297 at epoch 4
loss: 4.016 

Epoch 50, lr: 5.695865504800327e-05
Train loss: 4.00880
loss: 4.009 
Saved plots to ./ckpt/2025-07-29_20-15-33Diffusion
 26%|██▌       | 51/200 [00:38<01:56,  1.28it/s]Val loss:   4.06633.   Best val loss: 3.68297 at epoch 4
loss: 4.066 

Epoch 51, lr: 5.522642316338268e-05
Train loss: 3.77967
loss: 3.780 
Saved plots to ./ckpt/2025-07-29_20-15-33Diffusion
 26%|██▌       | 52/200 [00:39<01:55,  1.28it/s]Val loss:   3.89660.   Best val loss: 3.68297 at epoch 4
loss: 3.897 

Epoch 52, lr: 5.348782368720626e-05
Train loss: 3.91714
loss: 3.917 
Saved plots to ./ckpt/2025-07-29_20-15-33Diffusion
 26%|██▋       | 53/200 [00:39<01:54,  1.28it/s]Val loss:   4.13794.   Best val loss: 3.68297 at epoch 4
loss: 4.138 

Epoch 53, lr: 5.174497483512506e-05
Train loss: 4.08717
loss: 4.087 
Saved plots to ./ckpt/2025-07-29_20-15-33Diffusion
 27%|██▋       | 54/200 [00:40<01:55,  1.26it/s]Val loss:   3.94093.   Best val loss: 3.68297 at epoch 4
loss: 3.941 

Epoch 54, lr: 5e-05
Train loss: 4.06881
loss: 4.069 
Saved plots to ./ckpt/2025-07-29_20-15-33Diffusion
 28%|██▊       | 55/200 [00:41<01:56,  1.25it/s]Val loss:   3.99862.   Best val loss: 3.68297 at epoch 4
loss: 3.999 

Epoch 55, lr: 4.825502516487497e-05
Train loss: 3.95992
loss: 3.960 
Saved plots to ./ckpt/2025-07-29_20-15-33Diffusion
 28%|██▊       | 56/200 [00:42<01:55,  1.24it/s]Val loss:   4.05263.   Best val loss: 3.68297 at epoch 4
loss: 4.053 

Epoch 56, lr: 4.6512176312793736e-05
Train loss: 4.11913
loss: 4.119 
Saved plots to ./ckpt/2025-07-29_20-15-33Diffusion
 28%|██▊       | 57/200 [00:43<01:54,  1.25it/s]Val loss:   4.04867.   Best val loss: 3.68297 at epoch 4
loss: 4.049 

Epoch 57, lr: 4.477357683661734e-05
Train loss: 3.95680
loss: 3.957 
Saved plots to ./ckpt/2025-07-29_20-15-33Diffusion
 29%|██▉       | 58/200 [00:43<01:56,  1.22it/s]Val loss:   3.92916.   Best val loss: 3.68297 at epoch 4
loss: 3.929 

Epoch 58, lr: 4.3041344951996746e-05
Train loss: 4.10325
loss: 4.103 
Saved plots to ./ckpt/2025-07-29_20-15-33Diffusion
 30%|██▉       | 59/200 [00:44<01:56,  1.21it/s]Val loss:   4.02564.   Best val loss: 3.68297 at epoch 4
loss: 4.026 

Epoch 59, lr: 4.131759111665349e-05
Train loss: 3.91161
loss: 3.912 
Saved plots to ./ckpt/2025-07-29_20-15-33Diffusion
 30%|███       | 60/200 [00:45<01:54,  1.22it/s]Val loss:   4.04177.   Best val loss: 3.68297 at epoch 4
loss: 4.042 

Epoch 60, lr: 3.960441545911204e-05
Train loss: 4.03065
loss: 4.031 
Saved plots to ./ckpt/2025-07-29_20-15-33Diffusion
 30%|███       | 61/200 [00:46<01:54,  1.21it/s]Val loss:   4.23643.   Best val loss: 3.68297 at epoch 4
loss: 4.236 

Epoch 61, lr: 3.790390522001662e-05
Train loss: 3.95125
loss: 3.951 
Saved plots to ./ckpt/2025-07-29_20-15-33Diffusion
 31%|███       | 62/200 [00:47<01:53,  1.21it/s]Val loss:   4.00427.   Best val loss: 3.68297 at epoch 4
loss: 4.004 

Epoch 62, lr: 3.6218132209150045e-05
Train loss: 4.04780
loss: 4.048 
Saved plots to ./ckpt/2025-07-29_20-15-33Diffusion
 32%|███▁      | 63/200 [00:47<01:51,  1.22it/s]Val loss:   4.10006.   Best val loss: 3.68297 at epoch 4
loss: 4.100 

Epoch 63, lr: 3.4549150281252636e-05
Train loss: 4.13316
loss: 4.133 
Saved plots to ./ckpt/2025-07-29_20-15-33Diffusion
 32%|███▁      | 64/200 [00:48<01:52,  1.21it/s]Val loss:   3.95496.   Best val loss: 3.68297 at epoch 4
loss: 3.955 

Epoch 64, lr: 3.289899283371657e-05
Train loss: 3.95479
loss: 3.955 
Saved plots to ./ckpt/2025-07-29_20-15-33Diffusion
 32%|███▎      | 65/200 [00:49<01:53,  1.19it/s]Val loss:   3.85945.   Best val loss: 3.68297 at epoch 4
loss: 3.859 

Epoch 65, lr: 3.12696703292044e-05
Train loss: 4.11597
loss: 4.116 
Saved plots to ./ckpt/2025-07-29_20-15-33Diffusion
 33%|███▎      | 66/200 [00:50<01:53,  1.18it/s]Val loss:   4.04585.   Best val loss: 3.68297 at epoch 4
loss: 4.046 

Epoch 66, lr: 2.9663167846209998e-05
Train loss: 4.05236
loss: 4.052 
Saved plots to ./ckpt/2025-07-29_20-15-33Diffusion
 34%|███▎      | 67/200 [00:51<01:52,  1.18it/s]Val loss:   3.85482.   Best val loss: 3.68297 at epoch 4
loss: 3.855 

Epoch 67, lr: 2.8081442660546125e-05
Train loss: 4.02807
loss: 4.028 
Saved plots to ./ckpt/2025-07-29_20-15-33Diffusion
 34%|███▁      | 68/200 [00:52<01:52,  1.17it/s]Val loss:   3.84378.   Best val loss: 3.68297 at epoch 4
loss: 3.844 

Epoch 68, lr: 2.6526421860705473e-05
Train loss: 3.94188
loss: 3.942 
Saved plots to ./ckpt/2025-07-29_20-15-33Diffusion
 34%|███▁      | 69/200 [00:53<01:51,  1.17it/s]Val loss:   3.85912.   Best val loss: 3.68297 at epoch 4
loss: 3.859 

Epoch 69, lr: 2.500000000000001e-05
Train loss: 4.08491
loss: 4.085 
Saved plots to ./ckpt/2025-07-29_20-15-33Diffusion
 35%|███▌      | 70/200 [00:54<01:52,  1.16it/s]Val loss:   4.04422.   Best val loss: 3.68297 at epoch 4
loss: 4.044 

Epoch 70, lr: 2.350403678833976e-05
Train loss: 4.05905
loss: 4.059 
Saved plots to ./ckpt/2025-07-29_20-15-33Diffusion
 36%|███▌      | 71/200 [00:54<01:51,  1.16it/s]Val loss:   4.06557.   Best val loss: 3.68297 at epoch 4
loss: 4.066 

Epoch 71, lr: 2.2040354826462668e-05
Train loss: 3.97893
loss: 3.979 
Saved plots to ./ckpt/2025-07-29_20-15-33Diffusion
 36%|███▌      | 72/200 [00:55<01:51,  1.15it/s]Val loss:   4.11646.   Best val loss: 3.68297 at epoch 4
loss: 4.116 

Epoch 72, lr: 2.061073738537635e-05
Train loss: 4.03633
loss: 4.036 
Saved plots to ./ckpt/2025-07-29_20-15-33Diffusion
 36%|███▋      | 73/200 [00:56<01:50,  1.15it/s]Val loss:   3.86957.   Best val loss: 3.68297 at epoch 4
loss: 3.870 

Epoch 73, lr: 1.9216926233717085e-05
Train loss: 3.93996
loss: 3.940 
Saved plots to ./ckpt/2025-07-29_20-15-33Diffusion
 37%|███▋      | 74/200 [00:57<01:58,  1.06it/s]Val loss:   3.93109.   Best val loss: 3.68297 at epoch 4
loss: 3.931 

Epoch 74, lr: 1.7860619515673033e-05
Train loss: 4.01645
loss: 4.016 
Saved plots to ./ckpt/2025-07-29_20-15-33Diffusion
 38%|███▊      | 75/200 [00:58<01:57,  1.06it/s]Val loss:   3.97032.   Best val loss: 3.68297 at epoch 4
loss: 3.970 

Epoch 75, lr: 1.6543469682057106e-05
Train loss: 3.97293
loss: 3.973 
Saved plots to ./ckpt/2025-07-29_20-15-33Diffusion
 38%|███▊      | 76/200 [00:59<01:55,  1.08it/s]Val loss:   4.04682.   Best val loss: 3.68297 at epoch 4
loss: 4.047 

Epoch 76, lr: 1.526708147705013e-05
Train loss: 3.93582
loss: 3.936 
Saved plots to ./ckpt/2025-07-29_20-15-33Diffusion
 38%|███▊      | 77/200 [01:00<01:53,  1.08it/s]Val loss:   3.96387.   Best val loss: 3.68297 at epoch 4
loss: 3.964 

Epoch 77, lr: 1.4033009983067452e-05
Train loss: 4.08482
loss: 4.085 
Saved plots to ./ckpt/2025-07-29_20-15-33Diffusion
 39%|███▉      | 78/200 [01:01<01:50,  1.10it/s]Val loss:   4.04908.   Best val loss: 3.68297 at epoch 4
loss: 4.049 

Epoch 78, lr: 1.2842758726130283e-05
Train loss: 3.94710
loss: 3.947 
Saved plots to ./ckpt/2025-07-29_20-15-33Diffusion
 40%|███▉      | 79/200 [01:02<01:48,  1.11it/s]Val loss:   4.03170.   Best val loss: 3.68297 at epoch 4
loss: 4.032 

Epoch 79, lr: 1.1697777844051105e-05
Train loss: 4.01367
loss: 4.014 
Saved plots to ./ckpt/2025-07-29_20-15-33Diffusion
 40%|████      | 80/200 [01:03<01:47,  1.11it/s]Val loss:   4.03667.   Best val loss: 3.68297 at epoch 4
loss: 4.037 

Epoch 80, lr: 1.0599462319663905e-05
Train loss: 4.03036
loss: 4.030 
Saved plots to ./ckpt/2025-07-29_20-15-33Diffusion
 40%|████      | 81/200 [01:04<01:45,  1.12it/s]Val loss:   3.98526.   Best val loss: 3.68297 at epoch 4
loss: 3.985 

Epoch 81, lr: 9.549150281252633e-06
Train loss: 4.01937
loss: 4.019 
Saved plots to ./ckpt/2025-07-29_20-15-33Diffusion
 41%|████      | 82/200 [01:04<01:45,  1.12it/s]Val loss:   4.04262.   Best val loss: 3.68297 at epoch 4
loss: 4.043 

Epoch 82, lr: 8.548121372247918e-06
Train loss: 3.98828
loss: 3.988 
Saved plots to ./ckpt/2025-07-29_20-15-33Diffusion
 42%|████▁     | 83/200 [01:05<01:45,  1.10it/s]Val loss:   4.03264.   Best val loss: 3.68297 at epoch 4
loss: 4.033 

Epoch 83, lr: 7.597595192178702e-06
Train loss: 4.13342
loss: 4.133 
Saved plots to ./ckpt/2025-07-29_20-15-33Diffusion
 42%|████▁     | 84/200 [01:06<01:44,  1.11it/s]Val loss:   4.04415.   Best val loss: 3.68297 at epoch 4
loss: 4.044 

Epoch 84, lr: 6.698729810778065e-06
Train loss: 3.90998
loss: 3.910 
Saved plots to ./ckpt/2025-07-29_20-15-33Diffusion
 42%|████▎     | 85/200 [01:07<01:43,  1.11it/s]Val loss:   4.00973.   Best val loss: 3.68297 at epoch 4
loss: 4.010 

Epoch 85, lr: 5.852620357053651e-06
Train loss: 4.00730
loss: 4.007 
Saved plots to ./ckpt/2025-07-29_20-15-33Diffusion
 43%|████▎     | 86/200 [01:08<01:43,  1.10it/s]Val loss:   4.02684.   Best val loss: 3.68297 at epoch 4
loss: 4.027 

Epoch 86, lr: 5.060297685041659e-06
Train loss: 3.84951
loss: 3.850 
Saved plots to ./ckpt/2025-07-29_20-15-33Diffusion
 44%|████▎     | 87/200 [01:09<01:44,  1.08it/s]Val loss:   4.03036.   Best val loss: 3.68297 at epoch 4
loss: 4.030 

Epoch 87, lr: 4.322727117869951e-06
Train loss: 3.97272
loss: 3.973 
Saved plots to ./ckpt/2025-07-29_20-15-33Diffusion
 44%|████▁     | 88/200 [01:10<01:42,  1.10it/s]Val loss:   3.80578.   Best val loss: 3.68297 at epoch 4
loss: 3.806 

Epoch 88, lr: 3.6408072716606346e-06
Train loss: 3.95582
loss: 3.956 
Saved plots to ./ckpt/2025-07-29_20-15-33Diffusion
 44%|████▁     | 89/200 [01:11<01:41,  1.09it/s]Val loss:   4.07984.   Best val loss: 3.68297 at epoch 4
loss: 4.080 

Epoch 89, lr: 3.0153689607045845e-06
Train loss: 4.04905
loss: 4.049 
Saved plots to ./ckpt/2025-07-29_20-15-33Diffusion
 45%|████▌     | 90/200 [01:12<01:40,  1.09it/s]Val loss:   3.99237.   Best val loss: 3.68297 at epoch 4
loss: 3.992 

Epoch 90, lr: 2.4471741852423237e-06
Train loss: 3.99686
loss: 3.997 
Saved plots to ./ckpt/2025-07-29_20-15-33Diffusion
 46%|████▌     | 91/200 [01:13<01:39,  1.09it/s]Val loss:   3.92904.   Best val loss: 3.68297 at epoch 4
loss: 3.929 

Epoch 91, lr: 1.9369152030840556e-06
Train loss: 3.99864
loss: 3.999 
Saved plots to ./ckpt/2025-07-29_20-15-33Diffusion
 46%|████▌     | 92/200 [01:14<01:39,  1.09it/s]Val loss:   3.95236.   Best val loss: 3.68297 at epoch 4
loss: 3.952 

Epoch 92, lr: 1.4852136862001764e-06
Train loss: 4.00378
loss: 4.004 
Saved plots to ./ckpt/2025-07-29_20-15-33Diffusion
 46%|████▋     | 93/200 [01:15<01:37,  1.09it/s]Val loss:   3.96966.   Best val loss: 3.68297 at epoch 4
loss: 3.970 

Epoch 93, lr: 1.0926199633097157e-06
Train loss: 3.95558
loss: 3.956 
Saved plots to ./ckpt/2025-07-29_20-15-33Diffusion
 47%|████▋     | 94/200 [01:15<01:36,  1.10it/s]Val loss:   4.02996.   Best val loss: 3.68297 at epoch 4
loss: 4.030 

Epoch 94, lr: 7.596123493895991e-07
Train loss: 3.99290
loss: 3.993 
Saved plots to ./ckpt/2025-07-29_20-15-33Diffusion
 48%|████▊     | 95/200 [01:16<01:35,  1.10it/s]Val loss:   3.93882.   Best val loss: 3.68297 at epoch 4
loss: 3.939 

Epoch 95, lr: 4.865965629214819e-07
Train loss: 4.02191
loss: 4.022 
Saved plots to ./ckpt/2025-07-29_20-15-33Diffusion
 48%|████▊     | 96/200 [01:17<01:34,  1.10it/s]Val loss:   4.05541.   Best val loss: 3.68297 at epoch 4
loss: 4.055 

Epoch 96, lr: 2.7390523158633554e-07
Train loss: 3.99911
loss: 3.999 
Saved plots to ./ckpt/2025-07-29_20-15-33Diffusion
 48%|████▊     | 97/200 [01:18<01:35,  1.08it/s]Val loss:   3.96143.   Best val loss: 3.68297 at epoch 4
loss: 3.961 

Epoch 97, lr: 1.2179748700879012e-07
Train loss: 4.06224
loss: 4.062 
Saved plots to ./ckpt/2025-07-29_20-15-33Diffusion
 49%|████▉     | 98/200 [01:19<01:35,  1.07it/s]Val loss:   4.14953.   Best val loss: 3.68297 at epoch 4
loss: 4.150 

Epoch 98, lr: 3.04586490452119e-08
Train loss: 3.96464
loss: 3.965 
Saved plots to ./ckpt/2025-07-29_20-15-33Diffusion
 50%|████▉     | 99/200 [01:20<01:37,  1.04it/s]Val loss:   4.02175.   Best val loss: 3.68297 at epoch 4
loss: 4.022 

Epoch 99, lr: 0.0
Train loss: 4.00542
loss: 4.005 
Saved plots to ./ckpt/2025-07-29_20-15-33Diffusion
 50%|█████     | 100/200 [01:21<01:37,  1.03it/s]Val loss:   4.06439.   Best val loss: 3.68297 at epoch 4
loss: 4.064 

Epoch 100, lr: 3.04586490452119e-08
Train loss: 4.01010
loss: 4.010 
Saved plots to ./ckpt/2025-07-29_20-15-33Diffusion
 50%|█████     | 101/200 [01:22<01:35,  1.04it/s]Val loss:   3.92656.   Best val loss: 3.68297 at epoch 4
loss: 3.927 

Epoch 101, lr: 1.2179748700878456e-07
Train loss: 3.94941
loss: 3.949 
Saved plots to ./ckpt/2025-07-29_20-15-33Diffusion
 51%|█████     | 102/200 [01:23<01:32,  1.05it/s]Val loss:   3.98260.   Best val loss: 3.68297 at epoch 4
loss: 3.983 

Epoch 102, lr: 2.7390523158633554e-07
Train loss: 3.95028
loss: 3.950 
Saved plots to ./ckpt/2025-07-29_20-15-33Diffusion
 52%|█████▁    | 103/200 [01:24<01:32,  1.05it/s]Val loss:   4.18619.   Best val loss: 3.68297 at epoch 4
loss: 4.186 

Epoch 103, lr: 4.865965629214875e-07
Train loss: 3.93808
loss: 3.938 
Saved plots to ./ckpt/2025-07-29_20-15-33Diffusion
 52%|█████▁    | 104/200 [01:25<01:32,  1.04it/s]Val loss:   3.99554.   Best val loss: 3.68297 at epoch 4
loss: 3.996 

Epoch 104, lr: 7.596123493895991e-07
Train loss: 3.98673
loss: 3.987 
Saved plots to ./ckpt/2025-07-29_20-15-33Diffusion
 52%|█████▎    | 105/200 [01:26<01:32,  1.03it/s]Val loss:   3.87552.   Best val loss: 3.68297 at epoch 4
loss: 3.876 

Epoch 105, lr: 1.0926199633097157e-06
Train loss: 4.07308
loss: 4.073 
Saved plots to ./ckpt/2025-07-29_20-15-33Diffusion
 53%|█████▎    | 106/200 [01:27<01:31,  1.02it/s]Val loss:   3.88230.   Best val loss: 3.68297 at epoch 4
loss: 3.882 

Epoch 106, lr: 1.4852136862001764e-06
Train loss: 3.96638
loss: 3.966 
Saved plots to ./ckpt/2025-07-29_20-15-33Diffusion
 54%|█████▎    | 107/200 [01:28<01:30,  1.03it/s]Val loss:   3.86510.   Best val loss: 3.68297 at epoch 4
loss: 3.865 

Epoch 107, lr: 1.93691520308405e-06
Train loss: 4.00230
loss: 4.002 
Saved plots to ./ckpt/2025-07-29_20-15-33Diffusion
 54%|█████▁    | 108/200 [01:29<01:29,  1.02it/s]Val loss:   3.88680.   Best val loss: 3.68297 at epoch 4
loss: 3.887 

Epoch 108, lr: 2.4471741852423237e-06
Train loss: 3.98415
loss: 3.984 
Saved plots to ./ckpt/2025-07-29_20-15-33Diffusion
 55%|█████▁    | 109/200 [01:31<01:49,  1.20s/it]Best ckpt saved, val loss 3.613483 @ epoch108
Val loss:   3.61348.   Best val loss: 3.61348 at epoch 108
loss: 3.613 

Epoch 109, lr: 3.0153689607045785e-06
Train loss: 3.90927
loss: 3.909 
Saved plots to ./ckpt/2025-07-29_20-15-33Diffusion
 55%|█████▌    | 110/200 [01:32<01:42,  1.14s/it]Val loss:   3.94451.   Best val loss: 3.61348 at epoch 108
loss: 3.945 

Epoch 110, lr: 3.640807271660629e-06
Train loss: 4.11413
loss: 4.114 
Saved plots to ./ckpt/2025-07-29_20-15-33Diffusion
 56%|█████▌    | 111/200 [01:33<01:35,  1.08s/it]Val loss:   4.03421.   Best val loss: 3.61348 at epoch 108
loss: 4.034 

Epoch 111, lr: 4.322727117869946e-06
Train loss: 4.01620
loss: 4.016 
Saved plots to ./ckpt/2025-07-29_20-15-33Diffusion
 56%|█████▌    | 112/200 [01:34<01:32,  1.05s/it]Val loss:   3.91320.   Best val loss: 3.61348 at epoch 108
loss: 3.913 

Epoch 112, lr: 5.060297685041643e-06
Train loss: 4.04204
loss: 4.042 
Saved plots to ./ckpt/2025-07-29_20-15-33Diffusion
 56%|█████▋    | 113/200 [01:35<01:31,  1.05s/it]Val loss:   3.96453.   Best val loss: 3.61348 at epoch 108
loss: 3.965 

Epoch 113, lr: 5.852620357053646e-06
Train loss: 3.99077
loss: 3.991 
Saved plots to ./ckpt/2025-07-29_20-15-33Diffusion
 57%|█████▋    | 114/200 [01:36<01:29,  1.04s/it]Val loss:   3.85524.   Best val loss: 3.61348 at epoch 108
loss: 3.855 

Epoch 114, lr: 6.69872981077807e-06
Train loss: 4.00559
loss: 4.006 
Saved plots to ./ckpt/2025-07-29_20-15-33Diffusion
 57%|█████▊    | 115/200 [01:37<01:27,  1.03s/it]Val loss:   3.88460.   Best val loss: 3.61348 at epoch 108
loss: 3.885 

Epoch 115, lr: 7.597595192178697e-06
Train loss: 4.06212
loss: 4.062 
Saved plots to ./ckpt/2025-07-29_20-15-33Diffusion
 58%|█████▊    | 116/200 [01:38<01:27,  1.04s/it]Val loss:   3.88518.   Best val loss: 3.61348 at epoch 108
loss: 3.885 

Epoch 116, lr: 8.548121372247908e-06
Train loss: 3.93305
loss: 3.933 
Saved plots to ./ckpt/2025-07-29_20-15-33Diffusion
 58%|█████▊    | 117/200 [01:39<01:25,  1.03s/it]Val loss:   3.94753.   Best val loss: 3.61348 at epoch 108
loss: 3.948 

Epoch 117, lr: 9.549150281252623e-06
Train loss: 3.96482
loss: 3.965 
Saved plots to ./ckpt/2025-07-29_20-15-33Diffusion
 59%|█████▉    | 118/200 [01:40<01:23,  1.02s/it]Val loss:   3.94851.   Best val loss: 3.61348 at epoch 108
loss: 3.949 

Epoch 118, lr: 1.0599462319663888e-05
Train loss: 4.00970
loss: 4.010 
Saved plots to ./ckpt/2025-07-29_20-15-33Diffusion
 60%|█████▉    | 119/200 [01:41<01:23,  1.03s/it]Val loss:   3.84469.   Best val loss: 3.61348 at epoch 108
loss: 3.845 

Epoch 119, lr: 1.16977778440511e-05
Train loss: 3.84102
loss: 3.841 
Saved plots to ./ckpt/2025-07-29_20-15-33Diffusion
 60%|██████    | 120/200 [01:42<01:24,  1.05s/it]Val loss:   4.08663.   Best val loss: 3.61348 at epoch 108
loss: 4.087 

Epoch 120, lr: 1.2842758726130289e-05
Train loss: 4.08343
loss: 4.083 
Saved plots to ./ckpt/2025-07-29_20-15-33Diffusion
 60%|██████    | 121/200 [01:43<01:22,  1.04s/it]Val loss:   3.95671.   Best val loss: 3.61348 at epoch 108
loss: 3.957 

Epoch 121, lr: 1.4033009983067447e-05
Train loss: 4.07458
loss: 4.075 
Saved plots to ./ckpt/2025-07-29_20-15-33Diffusion
 61%|██████    | 122/200 [01:44<01:22,  1.05s/it]Val loss:   3.99928.   Best val loss: 3.61348 at epoch 108
loss: 3.999 

Epoch 122, lr: 1.526708147705012e-05
Train loss: 4.03910
loss: 4.039 
Saved plots to ./ckpt/2025-07-29_20-15-33Diffusion
 62%|██████▁   | 123/200 [01:45<01:21,  1.05s/it]Val loss:   3.91887.   Best val loss: 3.61348 at epoch 108
loss: 3.919 

Epoch 123, lr: 1.654346968205708e-05
Train loss: 3.96728
loss: 3.967 
Saved plots to ./ckpt/2025-07-29_20-15-33Diffusion
 62%|██████▁   | 124/200 [01:46<01:19,  1.05s/it]Val loss:   3.99554.   Best val loss: 3.61348 at epoch 108
loss: 3.996 

Epoch 124, lr: 1.7860619515673026e-05
Train loss: 3.91004
loss: 3.910 
Saved plots to ./ckpt/2025-07-29_20-15-33Diffusion
 62%|██████▎   | 125/200 [01:47<01:18,  1.04s/it]Val loss:   4.06528.   Best val loss: 3.61348 at epoch 108
loss: 4.065 

Epoch 125, lr: 1.92169262337171e-05
Train loss: 4.07165
loss: 4.072 
Saved plots to ./ckpt/2025-07-29_20-15-33Diffusion
 63%|██████▎   | 126/200 [01:48<01:17,  1.05s/it]Val loss:   4.07901.   Best val loss: 3.61348 at epoch 108
loss: 4.079 

Epoch 126, lr: 2.061073738537634e-05
Train loss: 3.93090
loss: 3.931 
Saved plots to ./ckpt/2025-07-29_20-15-33Diffusion
 64%|██████▎   | 127/200 [01:49<01:18,  1.07s/it]Val loss:   4.03246.   Best val loss: 3.61348 at epoch 108
loss: 4.032 

Epoch 127, lr: 2.2040354826462638e-05
Train loss: 4.05976
loss: 4.060 
Saved plots to ./ckpt/2025-07-29_20-15-33Diffusion
 64%|██████▁   | 128/200 [01:50<01:17,  1.08s/it]Val loss:   3.98426.   Best val loss: 3.61348 at epoch 108
loss: 3.984 

Epoch 128, lr: 2.350403678833975e-05
Train loss: 3.96336
loss: 3.963 
Saved plots to ./ckpt/2025-07-29_20-15-33Diffusion
 64%|██████▁   | 129/200 [01:51<01:15,  1.07s/it]Val loss:   4.12281.   Best val loss: 3.61348 at epoch 108
loss: 4.123 

Epoch 129, lr: 2.4999999999999977e-05
Train loss: 3.98403
loss: 3.984 
Saved plots to ./ckpt/2025-07-29_20-15-33Diffusion
 65%|██████▌   | 130/200 [01:53<01:16,  1.10s/it]Val loss:   4.04503.   Best val loss: 3.61348 at epoch 108
loss: 4.045 

Epoch 130, lr: 2.6526421860705463e-05
Train loss: 3.96118
loss: 3.961 
Saved plots to ./ckpt/2025-07-29_20-15-33Diffusion
 66%|██████▌   | 131/200 [01:54<01:14,  1.08s/it]Val loss:   3.94857.   Best val loss: 3.61348 at epoch 108
loss: 3.949 

Epoch 131, lr: 2.8081442660546115e-05
Train loss: 4.06692
loss: 4.067 
Saved plots to ./ckpt/2025-07-29_20-15-33Diffusion
 66%|██████▌   | 132/200 [01:55<01:16,  1.12s/it]Val loss:   4.12550.   Best val loss: 3.61348 at epoch 108
loss: 4.126 

Epoch 132, lr: 2.9663167846209994e-05
Train loss: 4.05116
loss: 4.051 
Saved plots to ./ckpt/2025-07-29_20-15-33Diffusion
 66%|██████▋   | 133/200 [01:56<01:15,  1.13s/it]Val loss:   4.01007.   Best val loss: 3.61348 at epoch 108
loss: 4.010 

Epoch 133, lr: 3.1269670329204384e-05
Train loss: 4.15337
loss: 4.153 
Saved plots to ./ckpt/2025-07-29_20-15-33Diffusion
 67%|██████▋   | 134/200 [01:57<01:16,  1.17s/it]Val loss:   4.03849.   Best val loss: 3.61348 at epoch 108
loss: 4.038 

Epoch 134, lr: 3.2898992833716535e-05
Train loss: 3.92551
loss: 3.926 
Saved plots to ./ckpt/2025-07-29_20-15-33Diffusion
 68%|██████▊   | 135/200 [01:58<01:15,  1.16s/it]Val loss:   3.77212.   Best val loss: 3.61348 at epoch 108
loss: 3.772 

Epoch 135, lr: 3.454915028125262e-05
Train loss: 4.12308
loss: 4.123 
Saved plots to ./ckpt/2025-07-29_20-15-33Diffusion
 68%|██████▊   | 136/200 [01:59<01:13,  1.15s/it]Val loss:   3.94185.   Best val loss: 3.61348 at epoch 108
loss: 3.942 

Epoch 136, lr: 3.621813220915006e-05
Train loss: 4.13402
loss: 4.134 
Saved plots to ./ckpt/2025-07-29_20-15-33Diffusion
 68%|██████▊   | 137/200 [02:01<01:12,  1.16s/it]Val loss:   3.95773.   Best val loss: 3.61348 at epoch 108
loss: 3.958 

Epoch 137, lr: 3.790390522001661e-05
Train loss: 4.06983
loss: 4.070 
Saved plots to ./ckpt/2025-07-29_20-15-33Diffusion
 69%|██████▉   | 138/200 [02:02<01:09,  1.12s/it]Val loss:   3.99217.   Best val loss: 3.61348 at epoch 108
loss: 3.992 

Epoch 138, lr: 3.960441545911201e-05
Train loss: 3.94289
loss: 3.943 
Saved plots to ./ckpt/2025-07-29_20-15-33Diffusion
 70%|██████▉   | 139/200 [02:03<01:07,  1.10s/it]Val loss:   3.98574.   Best val loss: 3.61348 at epoch 108
loss: 3.986 

Epoch 139, lr: 4.131759111665349e-05
Train loss: 4.14881
loss: 4.149 
Saved plots to ./ckpt/2025-07-29_20-15-33Diffusion
 70%|███████   | 140/200 [02:04<01:06,  1.11s/it]Val loss:   3.92956.   Best val loss: 3.61348 at epoch 108
loss: 3.930 

Epoch 140, lr: 4.304134495199671e-05
Train loss: 3.99202
loss: 3.992 
Saved plots to ./ckpt/2025-07-29_20-15-33Diffusion
 70%|███████   | 141/200 [02:05<01:06,  1.13s/it]Val loss:   3.98743.   Best val loss: 3.61348 at epoch 108
loss: 3.987 

Epoch 141, lr: 4.477357683661729e-05
Train loss: 4.08638
loss: 4.086 
Saved plots to ./ckpt/2025-07-29_20-15-33Diffusion
 71%|███████   | 142/200 [02:06<01:04,  1.11s/it]Val loss:   3.82832.   Best val loss: 3.61348 at epoch 108
loss: 3.828 

Epoch 142, lr: 4.651217631279372e-05
Train loss: 4.01063
loss: 4.011 
Saved plots to ./ckpt/2025-07-29_20-15-33Diffusion
 72%|███████▁  | 143/200 [02:07<01:02,  1.10s/it]Val loss:   4.02586.   Best val loss: 3.61348 at epoch 108
loss: 4.026 

Epoch 143, lr: 4.825502516487496e-05
Train loss: 3.93253
loss: 3.933 
Saved plots to ./ckpt/2025-07-29_20-15-33Diffusion
 72%|███████▁  | 144/200 [02:08<01:02,  1.11s/it]Val loss:   3.96280.   Best val loss: 3.61348 at epoch 108
loss: 3.963 

Epoch 144, lr: 4.999999999999999e-05
Train loss: 4.16301
loss: 4.163 
Saved plots to ./ckpt/2025-07-29_20-15-33Diffusion
 72%|███████▎  | 145/200 [02:09<01:00,  1.11s/it]Val loss:   4.12625.   Best val loss: 3.61348 at epoch 108
loss: 4.126 

Epoch 145, lr: 5.174497483512503e-05
Train loss: 4.08753
loss: 4.088 
Saved plots to ./ckpt/2025-07-29_20-15-33Diffusion
 73%|███████▎  | 146/200 [02:11<00:59,  1.10s/it]Val loss:   3.99310.   Best val loss: 3.61348 at epoch 108
loss: 3.993 

Epoch 146, lr: 5.348782368720626e-05
Train loss: 3.87889
loss: 3.879 
Saved plots to ./ckpt/2025-07-29_20-15-33Diffusion
 74%|███████▎  | 147/200 [02:12<00:58,  1.10s/it]Val loss:   3.98122.   Best val loss: 3.61348 at epoch 108
loss: 3.981 

Epoch 147, lr: 5.52264231633827e-05
Train loss: 3.88204
loss: 3.882 
Saved plots to ./ckpt/2025-07-29_20-15-33Diffusion
 74%|███████▁  | 148/200 [02:13<00:57,  1.11s/it]Val loss:   4.01369.   Best val loss: 3.61348 at epoch 108
loss: 4.014 

Epoch 148, lr: 5.695865504800327e-05
Train loss: 4.04943
loss: 4.049 
Saved plots to ./ckpt/2025-07-29_20-15-33Diffusion
 74%|███████▁  | 149/200 [02:14<00:57,  1.13s/it]Val loss:   3.73949.   Best val loss: 3.61348 at epoch 108
loss: 3.739 

Epoch 149, lr: 5.8682408883346504e-05
Train loss: 4.00002
loss: 4.000 
Saved plots to ./ckpt/2025-07-29_20-15-33Diffusion
 75%|███████▌  | 150/200 [02:15<01:00,  1.22s/it]Val loss:   4.05213.   Best val loss: 3.61348 at epoch 108
loss: 4.052 

Epoch 150, lr: 6.039558454088797e-05
Train loss: 3.98864
loss: 3.989 
Saved plots to ./ckpt/2025-07-29_20-15-33Diffusion
 76%|███████▌  | 151/200 [02:16<00:57,  1.17s/it]Val loss:   3.98106.   Best val loss: 3.61348 at epoch 108
loss: 3.981 

Epoch 151, lr: 6.209609477998338e-05
Train loss: 4.00182
loss: 4.002 
Saved plots to ./ckpt/2025-07-29_20-15-33Diffusion
 76%|███████▌  | 152/200 [02:18<00:55,  1.16s/it]Val loss:   4.03013.   Best val loss: 3.61348 at epoch 108
loss: 4.030 

Epoch 152, lr: 6.378186779084993e-05
Train loss: 3.97780
loss: 3.978 
Saved plots to ./ckpt/2025-07-29_20-15-33Diffusion
 76%|███████▋  | 153/200 [02:19<00:54,  1.15s/it]Val loss:   3.96396.   Best val loss: 3.61348 at epoch 108
loss: 3.964 

Epoch 153, lr: 6.545084971874737e-05
Train loss: 3.97063
loss: 3.971 
Saved plots to ./ckpt/2025-07-29_20-15-33Diffusion
 77%|███████▋  | 154/200 [02:20<00:52,  1.15s/it]Val loss:   4.06160.   Best val loss: 3.61348 at epoch 108
loss: 4.062 

Epoch 154, lr: 6.710100716628344e-05
Train loss: 4.01113
loss: 4.011 
Saved plots to ./ckpt/2025-07-29_20-15-33Diffusion
 78%|███████▊  | 155/200 [02:21<00:51,  1.15s/it]Val loss:   4.10397.   Best val loss: 3.61348 at epoch 108
loss: 4.104 

Epoch 155, lr: 6.87303296707956e-05
Train loss: 4.05307
loss: 4.053 
Saved plots to ./ckpt/2025-07-29_20-15-33Diffusion
 78%|███████▊  | 156/200 [02:22<00:50,  1.14s/it]Val loss:   3.93013.   Best val loss: 3.61348 at epoch 108
loss: 3.930 

Epoch 156, lr: 7.033683215379e-05
Train loss: 3.94181
loss: 3.942 
Saved plots to ./ckpt/2025-07-29_20-15-33Diffusion
 78%|███████▊  | 157/200 [02:23<00:48,  1.13s/it]Val loss:   3.89469.   Best val loss: 3.61348 at epoch 108
loss: 3.895 

Epoch 157, lr: 7.191855733945387e-05
Train loss: 4.02103
loss: 4.021 
Saved plots to ./ckpt/2025-07-29_20-15-33Diffusion
 79%|███████▉  | 158/200 [02:24<00:47,  1.14s/it]Val loss:   4.09408.   Best val loss: 3.61348 at epoch 108
loss: 4.094 

Epoch 158, lr: 7.347357813929451e-05
Train loss: 4.10312
loss: 4.103 
Saved plots to ./ckpt/2025-07-29_20-15-33Diffusion
 80%|███████▉  | 159/200 [02:26<00:48,  1.18s/it]Val loss:   3.90336.   Best val loss: 3.61348 at epoch 108
loss: 3.903 

Epoch 159, lr: 7.500000000000001e-05
Train loss: 3.97718
loss: 3.977 
Saved plots to ./ckpt/2025-07-29_20-15-33Diffusion
 80%|████████  | 160/200 [02:27<00:47,  1.19s/it]Val loss:   4.13467.   Best val loss: 3.61348 at epoch 108
loss: 4.135 

Epoch 160, lr: 7.649596321166023e-05
Train loss: 4.01156
loss: 4.012 
Saved plots to ./ckpt/2025-07-29_20-15-33Diffusion
 80%|████████  | 161/200 [02:28<00:46,  1.18s/it]Val loss:   3.94600.   Best val loss: 3.61348 at epoch 108
loss: 3.946 

Epoch 161, lr: 7.795964517353736e-05
Train loss: 4.01043
loss: 4.010 
Saved plots to ./ckpt/2025-07-29_20-15-33Diffusion
 81%|████████  | 162/200 [02:29<00:44,  1.18s/it]Val loss:   3.90068.   Best val loss: 3.61348 at epoch 108
loss: 3.901 

Epoch 162, lr: 7.938926261462365e-05
Train loss: 4.00817
loss: 4.008 
Saved plots to ./ckpt/2025-07-29_20-15-33Diffusion
 82%|████████▁ | 163/200 [02:30<00:43,  1.17s/it]Val loss:   4.21227.   Best val loss: 3.61348 at epoch 108
loss: 4.212 

Epoch 163, lr: 8.078307376628289e-05
Train loss: 3.92873
loss: 3.929 
Saved plots to ./ckpt/2025-07-29_20-15-33Diffusion
 82%|████████▁ | 164/200 [02:32<00:42,  1.19s/it]Val loss:   3.85502.   Best val loss: 3.61348 at epoch 108
loss: 3.855 

Epoch 164, lr: 8.213938048432697e-05
Train loss: 4.05311
loss: 4.053 
Saved plots to ./ckpt/2025-07-29_20-15-33Diffusion
 82%|████████▎ | 165/200 [02:33<00:41,  1.19s/it]Val loss:   3.99986.   Best val loss: 3.61348 at epoch 108
loss: 4.000 

Epoch 165, lr: 8.345653031794293e-05
Train loss: 4.02499
loss: 4.025 
Saved plots to ./ckpt/2025-07-29_20-15-33Diffusion
 83%|████████▎ | 166/200 [02:34<00:40,  1.19s/it]Val loss:   4.02200.   Best val loss: 3.61348 at epoch 108
loss: 4.022 

Epoch 166, lr: 8.473291852294987e-05
Train loss: 3.91250
loss: 3.913 
Saved plots to ./ckpt/2025-07-29_20-15-33Diffusion
 84%|████████▎ | 167/200 [02:35<00:39,  1.19s/it]Val loss:   3.95739.   Best val loss: 3.61348 at epoch 108
loss: 3.957 

Epoch 167, lr: 8.596699001693255e-05
Train loss: 4.04879
loss: 4.049 
Saved plots to ./ckpt/2025-07-29_20-15-33Diffusion
 84%|████████▁ | 168/200 [02:36<00:38,  1.19s/it]Val loss:   3.98990.   Best val loss: 3.61348 at epoch 108
loss: 3.990 

Epoch 168, lr: 8.715724127386968e-05
Train loss: 4.14069
loss: 4.141 
Saved plots to ./ckpt/2025-07-29_20-15-33Diffusion
 84%|████████▁ | 169/200 [02:38<00:37,  1.21s/it]Val loss:   3.93745.   Best val loss: 3.61348 at epoch 108
loss: 3.937 

Epoch 169, lr: 8.83022221559489e-05
Train loss: 3.94881
loss: 3.949 
Saved plots to ./ckpt/2025-07-29_20-15-33Diffusion
 85%|████████▌ | 170/200 [02:39<00:35,  1.18s/it]Val loss:   4.02025.   Best val loss: 3.61348 at epoch 108
loss: 4.020 

Epoch 170, lr: 8.94005376803361e-05
Train loss: 4.05626
loss: 4.056 
Saved plots to ./ckpt/2025-07-29_20-15-33Diffusion
 86%|████████▌ | 171/200 [02:40<00:34,  1.18s/it]Val loss:   3.96904.   Best val loss: 3.61348 at epoch 108
loss: 3.969 

Epoch 171, lr: 9.045084971874738e-05
Train loss: 4.09216
loss: 4.092 
Saved plots to ./ckpt/2025-07-29_20-15-33Diffusion
 86%|████████▌ | 172/200 [02:41<00:33,  1.20s/it]Val loss:   3.80683.   Best val loss: 3.61348 at epoch 108
loss: 3.807 

Epoch 172, lr: 9.145187862775207e-05
Train loss: 3.98378
loss: 3.984 
Saved plots to ./ckpt/2025-07-29_20-15-33Diffusion
 86%|████████▋ | 173/200 [02:42<00:32,  1.21s/it]Val loss:   4.22506.   Best val loss: 3.61348 at epoch 108
loss: 4.225 

Epoch 173, lr: 9.24024048078213e-05
Train loss: 3.99696
loss: 3.997 
Saved plots to ./ckpt/2025-07-29_20-15-33Diffusion
 87%|████████▋ | 174/200 [02:44<00:31,  1.22s/it]Val loss:   4.06653.   Best val loss: 3.61348 at epoch 108
loss: 4.067 

Epoch 174, lr: 9.330127018922193e-05
Train loss: 4.05040
loss: 4.050 
Saved plots to ./ckpt/2025-07-29_20-15-33Diffusion
 88%|████████▊ | 175/200 [02:45<00:30,  1.22s/it]Val loss:   3.89050.   Best val loss: 3.61348 at epoch 108
loss: 3.890 

Epoch 175, lr: 9.414737964294636e-05
Train loss: 3.96088
loss: 3.961 
Saved plots to ./ckpt/2025-07-29_20-15-33Diffusion
 88%|████████▊ | 176/200 [02:46<00:29,  1.22s/it]Val loss:   4.13863.   Best val loss: 3.61348 at epoch 108
loss: 4.139 

Epoch 176, lr: 9.493970231495834e-05
Train loss: 3.87106
loss: 3.871 
Saved plots to ./ckpt/2025-07-29_20-15-33Diffusion
 88%|████████▊ | 177/200 [02:47<00:28,  1.22s/it]Val loss:   3.89167.   Best val loss: 3.61348 at epoch 108
loss: 3.892 

Epoch 177, lr: 9.567727288213006e-05
Train loss: 3.94540
loss: 3.945 
Saved plots to ./ckpt/2025-07-29_20-15-33Diffusion
 89%|████████▉ | 178/200 [02:48<00:26,  1.22s/it]Val loss:   3.89406.   Best val loss: 3.61348 at epoch 108
loss: 3.894 

Epoch 178, lr: 9.635919272833938e-05
Train loss: 3.86677
loss: 3.867 
Saved plots to ./ckpt/2025-07-29_20-15-33Diffusion
 90%|████████▉ | 179/200 [02:50<00:25,  1.21s/it]Val loss:   4.05837.   Best val loss: 3.61348 at epoch 108
loss: 4.058 

Epoch 179, lr: 9.698463103929541e-05
Train loss: 4.09607
loss: 4.096 
Saved plots to ./ckpt/2025-07-29_20-15-33Diffusion
 90%|█████████ | 180/200 [02:51<00:24,  1.24s/it]Val loss:   3.91821.   Best val loss: 3.61348 at epoch 108
loss: 3.918 

Epoch 180, lr: 9.755282581475769e-05
Train loss: 4.18008
loss: 4.180 
Saved plots to ./ckpt/2025-07-29_20-15-33Diffusion
 90%|█████████ | 181/200 [02:52<00:24,  1.30s/it]Val loss:   3.74969.   Best val loss: 3.61348 at epoch 108
loss: 3.750 

Epoch 181, lr: 9.806308479691595e-05
Train loss: 4.03765
loss: 4.038 
Saved plots to ./ckpt/2025-07-29_20-15-33Diffusion
 91%|█████████ | 182/200 [02:54<00:22,  1.28s/it]Val loss:   4.02702.   Best val loss: 3.61348 at epoch 108
loss: 4.027 

Epoch 182, lr: 9.851478631379982e-05
Train loss: 3.97911
loss: 3.979 
Saved plots to ./ckpt/2025-07-29_20-15-33Diffusion
 92%|█████████▁| 183/200 [02:55<00:21,  1.27s/it]Val loss:   3.86855.   Best val loss: 3.61348 at epoch 108
loss: 3.869 

Epoch 183, lr: 9.890738003669029e-05
Train loss: 3.89231
loss: 3.892 
Saved plots to ./ckpt/2025-07-29_20-15-33Diffusion
 92%|█████████▁| 184/200 [02:56<00:20,  1.30s/it]Val loss:   3.98261.   Best val loss: 3.61348 at epoch 108
loss: 3.983 

Epoch 184, lr: 9.924038765061042e-05
Train loss: 3.94136
loss: 3.941 
Saved plots to ./ckpt/2025-07-29_20-15-33Diffusion
 92%|█████████▎| 185/200 [02:58<00:19,  1.29s/it]Val loss:   3.90175.   Best val loss: 3.61348 at epoch 108
loss: 3.902 

Epoch 185, lr: 9.951340343707851e-05
Train loss: 4.07345
loss: 4.073 
Saved plots to ./ckpt/2025-07-29_20-15-33Diffusion
 93%|█████████▎| 186/200 [02:59<00:18,  1.34s/it]Val loss:   3.94456.   Best val loss: 3.61348 at epoch 108
loss: 3.945 

Epoch 186, lr: 9.972609476841367e-05
Train loss: 4.08049
loss: 4.080 
Saved plots to ./ckpt/2025-07-29_20-15-33Diffusion
 94%|█████████▎| 187/200 [03:01<00:18,  1.42s/it]Val loss:   3.96370.   Best val loss: 3.61348 at epoch 108
loss: 3.964 

Epoch 187, lr: 9.987820251299122e-05
Train loss: 4.05771
loss: 4.058 
Saved plots to ./ckpt/2025-07-29_20-15-33Diffusion
 94%|█████████▁| 188/200 [03:02<00:16,  1.40s/it]Val loss:   4.19239.   Best val loss: 3.61348 at epoch 108
loss: 4.192 

Epoch 188, lr: 9.99695413509548e-05
Train loss: 3.86849
loss: 3.868 
Saved plots to ./ckpt/2025-07-29_20-15-33Diffusion
 94%|█████████▁| 189/200 [03:03<00:15,  1.39s/it]Val loss:   4.05292.   Best val loss: 3.61348 at epoch 108
loss: 4.053 

Epoch 189, lr: 0.0001
Train loss: 3.92881
loss: 3.929 
Saved plots to ./ckpt/2025-07-29_20-15-33Diffusion
 95%|█████████▌| 190/200 [03:05<00:13,  1.39s/it]Val loss:   4.14955.   Best val loss: 3.61348 at epoch 108
loss: 4.150 

Epoch 190, lr: 9.99695413509548e-05
Train loss: 3.96831
loss: 3.968 
Saved plots to ./ckpt/2025-07-29_20-15-33Diffusion
 96%|█████████▌| 191/200 [03:06<00:12,  1.36s/it]Val loss:   3.86057.   Best val loss: 3.61348 at epoch 108
loss: 3.861 

Epoch 191, lr: 9.987820251299122e-05
Train loss: 4.00394
loss: 4.004 
Saved plots to ./ckpt/2025-07-29_20-15-33Diffusion
 96%|█████████▌| 192/200 [03:08<00:12,  1.56s/it]Val loss:   3.83130.   Best val loss: 3.61348 at epoch 108
loss: 3.831 

Epoch 192, lr: 9.972609476841368e-05
Train loss: 4.11456
loss: 4.115 
Saved plots to ./ckpt/2025-07-29_20-15-33Diffusion
 96%|█████████▋| 193/200 [03:10<00:12,  1.72s/it]Val loss:   4.07785.   Best val loss: 3.61348 at epoch 108
loss: 4.078 

Epoch 193, lr: 9.951340343707854e-05
Train loss: 4.04460
loss: 4.045 
Saved plots to ./ckpt/2025-07-29_20-15-33Diffusion
 97%|█████████▋| 194/200 [03:12<00:11,  1.90s/it]Val loss:   4.11862.   Best val loss: 3.61348 at epoch 108
loss: 4.119 

Epoch 194, lr: 9.924038765061042e-05
Train loss: 3.86213
loss: 3.862 
Saved plots to ./ckpt/2025-07-29_20-15-33Diffusion
 98%|█████████▊| 195/200 [03:15<00:10,  2.00s/it]Val loss:   4.04254.   Best val loss: 3.61348 at epoch 108
loss: 4.043 

Epoch 195, lr: 9.890738003669029e-05
Train loss: 3.98136
loss: 3.981 
Saved plots to ./ckpt/2025-07-29_20-15-33Diffusion
 98%|█████████▊| 196/200 [03:16<00:07,  1.77s/it]Val loss:   4.00285.   Best val loss: 3.61348 at epoch 108
loss: 4.003 

Epoch 196, lr: 9.851478631379982e-05
Train loss: 4.08980
loss: 4.090 
Saved plots to ./ckpt/2025-07-29_20-15-33Diffusion
 98%|█████████▊| 197/200 [03:17<00:04,  1.62s/it]Val loss:   4.11376.   Best val loss: 3.61348 at epoch 108
loss: 4.114 

Epoch 197, lr: 9.806308479691595e-05
Train loss: 3.97894
loss: 3.979 
Saved plots to ./ckpt/2025-07-29_20-15-33Diffusion
 99%|█████████▉| 198/200 [03:19<00:03,  1.55s/it]Val loss:   3.92619.   Best val loss: 3.61348 at epoch 108
loss: 3.926 

Epoch 198, lr: 9.755282581475769e-05
Train loss: 4.09352
loss: 4.094 
Saved plots to ./ckpt/2025-07-29_20-15-33Diffusion
100%|█████████▉| 199/200 [03:20<00:01,  1.63s/it]Val loss:   4.14942.   Best val loss: 3.61348 at epoch 108
loss: 4.149 

Epoch 199, lr: 9.698463103929542e-05
Train loss: 4.02381
loss: 4.024 
Saved plots to ./ckpt/2025-07-29_20-15-33Diffusion
100%|██████████| 200/200 [03:22<00:00,  1.52s/it]100%|██████████| 200/200 [03:22<00:00,  1.01s/it]
Val loss:   4.04244.   Best val loss: 3.61348 at epoch 108
loss: 4.042 
Training finished:
Seed 0, val loss 3.613483 at epoch 108
Saved plots to ./ckpt/2025-07-29_20-15-33Diffusion
train.log File copied to ./ckpt/2025-07-29_20-15-33Diffusion/train.log
Best ckpt, val loss 3.613483 @ epoch108
